{
  "id" : "d97e25d7-4529-4864-ac85-66cc7633ce94",
  "downloadTime" : "2025-02-04T14:03:25.448+00:00",
  "failedAttempts" : 5,
  "failedReason" : "{\"Code\":3032,\"Message\":\"Usage no longer available for requested dates\",\"Help_URL\":\"http://example.com\",\"Data\":\"No usage data prior to Jan 2022 is available\"}",
  "apiExceptions" : [ {
    "code" : 3032,
    "message" : "Usage no longer available for requested dates",
    "helpUrl" : "http://example.com",
    "data" : "No usage data prior to Jan 2022 is available"
  } ],
  "release" : "5.1",
  "reportName" : "IR",
  "yearMonth" : "2021-10",
  "providerId" : "63c056c2-9e56-4148-8002-2a8649827d71"
}