{
  "downloadTime": "2019-02-01T08:00:00.000+0000",
  "release": "4",
  "reportName": "JR1",
  "yearMonth": "2019-02",
  "providerId": "4b659cb9-e4bb-493d-ae30-5f5690c54802",
  "report": {
    "vendor": {
      "id": "SEM001",
      "name": "Semantico Ltd.",
      "contact": [],
      "logoUrl": "http://www.semantico.com/wp-content/themes/semantico/images/logo-new.png",
      "webSiteUrl": "http://www.semantico.com"
    },
    "created": "2019-02-01T00:40:50.994Z",
    "name": "Journal Report 1 (R4)",
    "id": "1549010450995",
    "title": "JR1:4",
    "version": "4",
    "customer": [
      {
        "id": "customerId123",
        "contact": [],
        "reportItems": [
          {
            "itemDate": [],
            "itemName": "19th-Century Music",
            "itemDataType": "JOURNAL",
            "itemPlatform": "Ithaka",
            "itemAttribute": [],
            "itemPublisher": "University of California Press",
            "itemIdentifier": [
              {
                "type": "ONLINE_ISSN",
                "value": "1533-8606"
              },
              {
                "type": "PRINT_ISSN",
                "value": "0148-2076"
              }
            ],
            "itemContributor": [],
            "itemPerformance": [
              {
                "period": {
                  "end": "2019-02-28",
                  "begin": "2019-02-01"
                },
                "category": "REQUESTS",
                "instance": [
                  {
                    "count": 1,
                    "metricType": "FT_HTML"
                  },
                  {
                    "count": 1,
                    "metricType": "FT_PDF"
                  },
                  {
                    "count": 2,
                    "metricType": "FT_TOTAL"
                  }
                ]
              }
            ]
          }
        ],
        "institutionalIdentifier": []
      }
    ]
  }
}
