{
  "id": "06d79d97-2a70-4d8e-8262-7608bb846085",
  "downloadTime": "2020-07-09T01:08:05.232+00:00",
  "failedAttempts": 5,
  "failedReason": "Report not valid: Exception{Number=3030, Severity=ERROR, Message=No Usage Available for Requested Dates}",
  "apiExceptions": [
    {
      "code": 3030,
      "message": "No Usage Available for Requested Dates"
    }
  ],
  "release": "4",
  "reportName": "JR1",
  "yearMonth": "2019-10",
  "providerId": "d54f9d37-7759-44b6-a621-f950e6332d32"
}
