{
  "id": "7b9420f5-169b-43d2-a79e-391b90e192fe",
  "downloadTime": "2020-06-11T01:24:00.947+00:00",
  "release": "4",
  "reportName": "JR1",
  "yearMonth": "2019-08",
  "providerId": "d54f9d37-7759-44b6-a621-f950e6332d32",
  "report": {
    "vendor": {
      "id": "https://www.inderscienceonline.com",
      "name": "Inderscience Publishers",
      "contact": [
        {
          "email": "jrb@inderscience.com",
          "contact": "Inderscience Publishers"
        }
      ],
      "webSiteUrl": "https://www.inderscienceonline.com"
    },
    "created": "2020-06-10T18:05:00.000Z",
    "name": "JR1",
    "id": "www.inderscienceonline.com_journal1",
    "title": "Journal Report 1",
    "version": "4",
    "customer": [
      {
        "id": "123-45-678",
        "name": "CustomerName",
        "contact": [],
        "reportItems": [
          {
            "itemDate": [],
            "itemName": "International Journal of Decision Sciences, Risk and Management",
            "itemDataType": "JOURNAL",
            "itemPlatform": "Inderscience Publishers",
            "itemAttribute": [],
            "itemPublisher": "Inderscience Publishers",
            "itemIdentifier": [
              {
                "type": "DOI",
                "value": "10.1504/ijdsrm"
              },
              {
                "type": "PROPRIETARY",
                "value": "ijdsrm"
              },
              {
                "type": "PRINT_ISSN",
                "value": "1753-7169"
              },
              {
                "type": "ONLINE_ISSN",
                "value": "1753-7177"
              }
            ],
            "itemContributor": [],
            "itemPerformance": [
              {
                "period": {
                  "end": "2019-08-31",
                  "begin": "2019-08-01"
                },
                "category": "REQUESTS",
                "instance": [
                  {
                    "count": 1,
                    "metricType": "FT_PDF"
                  },
                  {
                    "count": 1,
                    "metricType": "FT_TOTAL"
                  }
                ]
              }
            ]
          },
          {
            "itemDate": [],
            "itemName": "International Journal of Digital Enterprise Technology",
            "itemDataType": "JOURNAL",
            "itemPlatform": "Inderscience Publishers",
            "itemAttribute": [],
            "itemPublisher": "Inderscience Publishers",
            "itemIdentifier": [
              {
                "type": "DOI",
                "value": "10.1504/ijdet"
              },
              {
                "type": "PROPRIETARY",
                "value": "ijdet"
              },
              {
                "type": "PRINT_ISSN",
                "value": "1756-2554"
              },
              {
                "type": "ONLINE_ISSN",
                "value": "1756-2562"
              }
            ],
            "itemContributor": [],
            "itemPerformance": [
              {
                "period": {
                  "end": "2019-08-31",
                  "begin": "2019-08-01"
                },
                "category": "REQUESTS",
                "instance": [
                  {
                    "count": 1,
                    "metricType": "FT_PDF"
                  },
                  {
                    "count": 1,
                    "metricType": "FT_TOTAL"
                  }
                ]
              }
            ]
          },
          {
            "itemDate": [],
            "itemName": "International Journal of Electronic Business",
            "itemDataType": "JOURNAL",
            "itemPlatform": "Inderscience Publishers",
            "itemAttribute": [],
            "itemPublisher": "Inderscience Publishers",
            "itemIdentifier": [
              {
                "type": "DOI",
                "value": "10.1504/ijeb"
              },
              {
                "type": "PROPRIETARY",
                "value": "ijeb"
              },
              {
                "type": "PRINT_ISSN",
                "value": "1470-6067"
              },
              {
                "type": "ONLINE_ISSN",
                "value": "1741-5063"
              }
            ],
            "itemContributor": [],
            "itemPerformance": [
              {
                "period": {
                  "end": "2019-08-31",
                  "begin": "2019-08-01"
                },
                "category": "REQUESTS",
                "instance": [
                  {
                    "count": 1,
                    "metricType": "FT_PDF"
                  },
                  {
                    "count": 1,
                    "metricType": "FT_TOTAL"
                  }
                ]
              }
            ]
          }
        ],
        "institutionalIdentifier": []
      }
    ]
  }
}
