{
  "id": "1ad95437-4f1b-4f3b-9654-622ff28d271d",
  "downloadTime": "2020-06-11T01:24:00.948+00:00",
  "release": "4",
  "reportName": "JR1",
  "yearMonth": "2019-01",
  "providerId": "d54f9d37-7759-44b6-a621-f950e6332d32",
  "report": {
    "vendor": {
      "id": "https://www.inderscienceonline.com",
      "name": "Inderscience Publishers",
      "contact": [
        {
          "email": "jrb@inderscience.com",
          "contact": "Inderscience Publishers"
        }
      ],
      "webSiteUrl": "https://www.inderscienceonline.com"
    },
    "created": "2020-06-10T18:04:00.000Z",
    "name": "JR1",
    "id": "www.inderscienceonline.com_journal1",
    "title": "Journal Report 1",
    "version": "4",
    "customer": [
      {
        "id": "123-45-678",
        "name": "CustomerName",
        "contact": [],
        "reportItems": [
          {
            "itemDate": [],
            "itemName": "International Journal of Internet of Things and Cyber-Assurance",
            "itemDataType": "JOURNAL",
            "itemPlatform": "Inderscience Publishers",
            "itemAttribute": [],
            "itemPublisher": "Inderscience Publishers",
            "itemIdentifier": [
              {
                "type": "DOI",
                "value": "10.1504/ijitca"
              },
              {
                "type": "PROPRIETARY",
                "value": "ijitca"
              },
              {
                "type": "PRINT_ISSN",
                "value": "2059-7967"
              },
              {
                "type": "ONLINE_ISSN",
                "value": "2059-7975"
              }
            ],
            "itemContributor": [],
            "itemPerformance": [
              {
                "period": {
                  "end": "2019-01-31",
                  "begin": "2019-01-01"
                },
                "category": "REQUESTS",
                "instance": [
                  {
                    "count": 1,
                    "metricType": "FT_PDF"
                  },
                  {
                    "count": 1,
                    "metricType": "FT_TOTAL"
                  }
                ]
              }
            ]
          },
          {
            "itemDate": [],
            "itemName": "International Journal of Supply Chain and Operations Resilience",
            "itemDataType": "JOURNAL",
            "itemPlatform": "Inderscience Publishers",
            "itemAttribute": [],
            "itemPublisher": "Inderscience Publishers",
            "itemIdentifier": [
              {
                "type": "DOI",
                "value": "10.1504/ijscor"
              },
              {
                "type": "PROPRIETARY",
                "value": "ijscor"
              },
              {
                "type": "PRINT_ISSN",
                "value": "2052-868X"
              },
              {
                "type": "ONLINE_ISSN",
                "value": "2052-8698"
              }
            ],
            "itemContributor": [],
            "itemPerformance": [
              {
                "period": {
                  "end": "2019-01-31",
                  "begin": "2019-01-01"
                },
                "category": "REQUESTS",
                "instance": [
                  {
                    "count": 2,
                    "metricType": "FT_PDF"
                  },
                  {
                    "count": 2,
                    "metricType": "FT_TOTAL"
                  }
                ]
              }
            ]
          }
        ],
        "institutionalIdentifier": []
      }
    ]
  }
}
